<?xml version="1.0" encoding="UTF-8"?>
<!--
List datatypes
	decimal  BigDecimal
	integer  BigInteger
	boolean  Boolean
	byte     Byte
	double   Double
	duration Duration
	float    Float
	int      Integer
	long     Long
	short    Short
	string   String
	dateTime XMLGregorianCalendar
-->
<ns4:document4
	xmlns:ns4="http://example.org/document" 
	xmlns:xsi="http://www.w3.org/2001/XMLSchema-instance" 
	xsi:schemaLocation="http://example.org/document ../../main/resources/document.xsd "
	
	fa_decimalValues="-7.50 5.75"
	fa_integerValues="-11 13"
	fa_booleanValues="true false"
	fa_byteValues="-128 127"
	fa_doubleValues="-3.14 2.718 -INF INF NaN"
	fa_durationValues="P3Y2M1D P6Y4M2D"
	fa_floatValues="-3.14 2.718 -INF INF NaN"
	fa_intValues="-123 123"
	fa_longValues="-123 123"
	fa_shortValues="-123 123"
	fa_dateTimeValues="2023-02-28T17:59:59.999Z 2023-03-01T17:59:59.999Z"
>
	<ns4:fv_decimalValues>-7.50 5.75</ns4:fv_decimalValues>
	<ns4:fv_integerValues>-11 13</ns4:fv_integerValues>
	<ns4:fv_booleanValues>true false</ns4:fv_booleanValues>
	<ns4:fv_byteValues>-128 127</ns4:fv_byteValues>
	<ns4:fv_doubleValues>-3.14 2.718 -INF INF NaN</ns4:fv_doubleValues>
	<ns4:fv_durationValues>P3Y2M1D P6Y4M2D</ns4:fv_durationValues>
	<ns4:fv_floatValues>-3.14 2.718 -INF INF NaN</ns4:fv_floatValues>
	<ns4:fv_intValues>-123 123</ns4:fv_intValues>
	<ns4:fv_longValues>-123 123</ns4:fv_longValues>
	<ns4:fv_shortValues>-123 123</ns4:fv_shortValues>
	<ns4:fv_stringValues>string1 string2</ns4:fv_stringValues>
	<ns4:fv_dateTimeValues>2023-02-28T17:59:59.999Z 2023-03-01T17:59:59.999Z</ns4:fv_dateTimeValues>	
</ns4:document4>
