<?xml version="1.0" encoding="UTF-8"?>
<!-- 
3.2 Primitive datatypes
	3.2.1 string
	3.2.2 boolean
	3.2.3 decimal
	3.2.4 float
	3.2.5 double
	3.2.6 duration
	3.2.7 dateTime
	3.2.8 time
	3.2.9 date
	3.2.10 gYearMonth
	3.2.11 gYear
	3.2.12 gMonthDay
	3.2.13 gDay
	3.2.14 gMonth
	3.2.15 hexBinary
	3.2.16 base64Binary
	3.2.17 anyURI
	3.2.18 QName
	3.2.19 NOTATION
-->
<ns2:document2
	xmlns:ns2="http://example.org/document" 
	xmlns:xsi="http://www.w3.org/2001/XMLSchema-instance" 
	xsi:schemaLocation="http://example.org/document ../../main/resources/document.xsd "

	fa_string="text" 
	fa_boolean="true" 
	fa_decimal="2.1" 
	fa_float="4.1" 
	fa_double="3.1" 
	fa_duration="P3Y2M1D" 
	fa_dateTime="2023-02-28T17:59:59.999Z" 
	fa_time="23:59:59"
	fa_date="2023-02-28Z"
	fa_gYearMonth="2023-02Z"
	fa_gYear="2023Z"
	fa_gMonthDay="--02-28Z"
	fa_gDay="---28Z"
	fa_gMonth="--02Z"
	fa_hexBinary="0FB8" 
	fa_base64Binary="dGV4dA==" 
	fa_anyURI="scheme://authority/path?query#fragment"
	fa_QName="ns2:localPart"
>
	<ns2:fv_string>text</ns2:fv_string>
	<ns2:fv_boolean>true</ns2:fv_boolean>
	<ns2:fv_decimal>-2.1</ns2:fv_decimal>
	<ns2:fv_float>-4.1</ns2:fv_float>
	<ns2:fv_double>-3.1</ns2:fv_double>
	<ns2:fv_duration>P3Y2M1D</ns2:fv_duration>
	<ns2:fv_dateTime>2023-02-28T17:59:59.999Z</ns2:fv_dateTime>
	<ns2:fv_time>23:59:59</ns2:fv_time>
	<ns2:fv_date>2023-02-28Z</ns2:fv_date>
	<ns2:fv_gYearMonth>2023-02Z</ns2:fv_gYearMonth>
	<ns2:fv_gYear>2023Z</ns2:fv_gYear>
	<ns2:fv_gMonthDay>--02-28Z</ns2:fv_gMonthDay>
	<ns2:fv_gDay>---28Z</ns2:fv_gDay>
	<ns2:fv_gMonth>--02Z</ns2:fv_gMonth>
	<ns2:fv_hexBinary>0FB8</ns2:fv_hexBinary>
	<ns2:fv_base64Binary>dGV4dA==</ns2:fv_base64Binary>
	<ns2:fv_anyURI>scheme://authority/path?query#fragment</ns2:fv_anyURI>
	<ns2:fv_QName>ns2:localPart</ns2:fv_QName>
</ns2:document2>
